{
  "data": [
    {
      "Status": "Retired",
      "Form Name": "triEmployee",
      "Active End Date": "23-Dec-2022",
      "Organization Name": "Maximo Org",
      "Address": "890 Zagu Highway",
      "boId": 106402,
      "First Name": "Connor",
      "Location Name": "",
      "Work Phone": "(620) 696-2298",
      "City": "Recgorug",
      "HR ID": "6720635493416960",
      "State/Province": "NL",
      "eMail": "muw@wule.tn",
      "recordId": 135500967,
      "Zip/Postal Code": "M1Q 7F4",
      "Active Start Date": "18-Oct-2018",
      "Country": "Madagascar",
      "Last Name": "Miles"
    }
  ],
  "continueToken": "",
  "header": [
    "Active End Date",
    "Status",
    "HR ID",
    "Active Start Date",
    "Address",
    "City",
    "Country",
    "eMail",
    "First Name",
    "Form Name",
    "Last Name",
    "State/Province",
    "Work Phone",
    "Zip/Postal Code",
    "Organization Name",
    "Location Name"
  ],
  "totalRows": 1
}
