{
  "data": [
    {
      "Status": "Active User",
      "Form Name": "triEmployee",
      "Active End Date": "02-Sep-2021",
      "Organization Name": "Maximo Org",
      "Address": "19 Main St",
      "boId": 106402,
      "First Name": "Carlos",
      "Location Hierarchy Path": "\\Locations\\Maximo Property\\Maximo Building\\Maximo Floor\\DES-01",
      "Location Name": "DES-01",
      "Work Phone": "(561) 573-3044",
      "City": "Bentonville",
      "Organization Hierarchy Path": "\\Organizations\\Maximo Org",
      "HR ID": "CMARIN",
      "Organization Record ID": "135499462",
      "State/Province": "Arkansas",
      "eMail": "cmarin@us.ibm.com",
      "recordId": 135499766,
      "Zip/Postal Code": "72713",
      "Active Start Date": "01-Jun-2021",
      "Country": "United States",
      "Last Name": "Marin",
      "Location Record ID": "135518290"
    }
  ],
  "continueToken": "",
  "header": [
    "HR ID",
    "First Name",
    "Last Name",
    "Active Start Date",
    "Active End Date",
    "Status",
    "Address",
    "City",
    "Country",
    "State/Province",
    "Zip/Postal Code",
    "eMail",
    "Work Phone",
    "Form Name",
    "Organization Record ID",
    "Organization Name",
    "Organization Hierarchy Path",
    "Location Record ID",
    "Location Name",
    "Location Hierarchy Path"
  ],
  "totalRows": 1
}
